{
  "schema_version": "0.1",
  "request_id": "adp-evl-req-001",
  "adapter_id": "adp-evl-harness",
  "task_type": "refactoring",
  "description": "Refactor module. Provide evidence.",
  "requested_capabilities": [
    "can_write_files"
  ],
  "boundary_declaration": {
    "allowed_actions": [
      "read_files",
      "write_files"
    ],
    "forbidden_actions": [
      "run_shell"
    ],
    "requires_review_for": [
      "run_shell"
    ],
    "credential_access_blocked": true,
    "external_api_blocked": true,
    "shell_blocked": true
  },
  "authority_statement": "Task request describes intent only. It does not authorize execution."
}
